{
  "version": "0.4.0-alpha",
  "containerId": "CLI-Experimental-Hello-LXC",
  "containment": "lxc",
  "process": {
    "commandLine": "echo 'Hello from LXC experimental!'"
  },
  "lifecycle": {
    "destroyOnExit": true
  },
  "lxc": {
    "distribution": "alpine",
    "release": "3.20"
  },
  "experimental": {
    "test": {
      "message": "Test feature from LXC experimental!"
    }
  }
}
